{
  "$schema": "https://json-schema.org/draft/2020-12/schema",
  "$id": "urn:web-report-sdk:contracts:builtin-event:web_vitals:0.2",
  "title": "内置事件 web_vitals（event_type: perf）",
  "description": "契约文档版本 0.2（2026-10-12 按兼容变更追加，不递增文档版本号）。校验对象是单个事件体，即 batch.schema.json $defs/event 那一层。dimensions、metrics 的键名与含义逐项对齐 event-standard.md 第 6 节的 web_vitals 行；metric_name 的取值集合来自该行明确列出的 FCP、LCP、CLS、INP、TTFB，rating 的取值集合于 2026-10-12 由架构负责人确认为 good、needs-improvement、poor。Q3 结论第 4 条要求自动采集的性能事件固定 priority: normal。",
  "type": "object",
  "required": [
    "event_id",
    "event_name",
    "event_type",
    "schema_version",
    "occurred_at",
    "priority",
    "dimensions",
    "metrics"
  ],
  "additionalProperties": false,
  "properties": {
    "event_id": { "$ref": "#/$defs/uuid" },
    "event_name": { "const": "web_vitals" },
    "event_type": { "const": "perf" },
    "schema_version": {
      "const": 1,
      "description": "内置事件定义的版本。修改内置定义时递增，规则见 README.md 的版本与兼容规则"
    },
    "occurred_at": { "$ref": "#/$defs/timestamp" },
    "priority": {
      "const": "normal",
      "description": "Q3 结论第 4 条：自动采集的错误、性能、页面浏览、HTTP 与 SDK 自监控事件一律为 normal"
    },
    "sample_rate": { "$ref": "#/$defs/sampleRate" },
    "page_id": { "type": "string", "maxLength": 256, "description": "路由模板，如 /task/:id" },
    "view_id": { "$ref": "#/$defs/uuid" },
    "url": { "type": "string", "maxLength": 2048, "description": "脱敏后的完整 URL" },
    "level": {
      "enum": ["debug", "info", "warn", "error"],
      "description": "event-standard.md 第 2 节：仅 event_type 为 log 时必填。本事件不使用本字段，保留它以与 batch.schema.json $defs/event 的字段集合保持一致"
    },
    "dimensions": {
      "type": "object",
      "description": "键名、含义见 event-standard.md 第 6 节 web_vitals 行：metric_name、rating",
      "required": ["metric_name", "rating"],
      "additionalProperties": false,
      "maxProperties": 50,
      "propertyNames": { "$ref": "#/$defs/fieldKey" },
      "properties": {
        "metric_name": {
          "enum": ["FCP", "LCP", "CLS", "INP", "TTFB"],
          "description": "Web Vitals 指标名；取值集合来自 event-standard.md 第 6 节 web_vitals 行，新增指标属于兼容变更"
        },
        "rating": {
          "enum": ["good", "needs-improvement", "poor"],
          "description": "该指标的评级，按 Web Vitals 阈值分级。取值集合由架构负责人于 2026-10-12 确认；新增取值属于兼容变更"
        }
      }
    },
    "metrics": {
      "type": "object",
      "description": "键名、含义见 event-standard.md 第 6 节 web_vitals 行：value、delta",
      "required": ["value", "delta"],
      "additionalProperties": false,
      "maxProperties": 50,
      "propertyNames": { "$ref": "#/$defs/fieldKey" },
      "properties": {
        "value": {
          "type": "number",
          "minimum": 0,
          "description": "指标值。FCP、LCP、INP、TTFB 为毫秒；CLS 为无量纲的累计布局偏移分数（event-standard.md 第 5 节）"
        },
        "delta": {
          "type": "number",
          "minimum": 0,
          "description": "相对上一次上报的增量；首次上报时等于 value。CLS 为累计值的增量"
        }
      }
    },
    "context": { "$ref": "#/$defs/dimensions" },
    "truncated": { "$ref": "#/$defs/truncated" },
    "retry_count": { "type": "integer", "minimum": 0, "maximum": 100 },
    "replayed": { "type": "boolean", "description": "是否为离线补发" }
  },
  "$defs": {
    "uuid": {
      "type": "string",
      "pattern": "^[0-9a-f]{8}-[0-9a-f]{4}-4[0-9a-f]{3}-[89ab][0-9a-f]{3}-[0-9a-f]{12}$"
    },
    "timestamp": { "type": "integer", "minimum": 1577836800000, "maximum": 4102444800000 },
    "fieldKey": { "type": "string", "pattern": "^[a-z][a-z0-9_]{0,63}$" },
    "sampleRate": { "type": "number", "exclusiveMinimum": 0, "maximum": 1 },
    "dimensions": {
      "type": "object",
      "description": "全局自定义上下文（context），与事件自有 dimensions 分开存放；约束同 batch.schema.json $defs/dimensions",
      "maxProperties": 50,
      "propertyNames": { "$ref": "#/$defs/fieldKey" },
      "additionalProperties": { "type": "string", "maxLength": 256 }
    },
    "truncated": {
      "type": "array",
      "description": "被截断的字段路径，如 dimensions.message、attachment（C04-F6）",
      "items": { "type": "string", "maxLength": 128 },
      "maxItems": 60,
      "uniqueItems": true
    }
  }
}
